{"attestation_id":"att-2","candidate_revision":"candidate-2","command":{"argv":["pnpm","test"],"working_directory":"."},"digest":"6dd61e85ad5fdcf28c9f426cff163543189cacbb6eb0d624dc009f7baa2af99b","environment":{"os":"test"},"observed_at":"2026-08-31T00:00:00Z","proof_id":"proof-1","record_digest":"ea2fd46ffd5cbfc55e0da7113bbc66c9072cc2da3a29ef8b7eabdddc121c61e1","record_type":"proof_attestation","result":"passed","retained_output":{"digest":"2d3adedff11b61f14c886e35afa036736dcd87a74d27b5c1510225d0f592e213","media_type":"application/octet-stream","size_bytes":1},"schema_version":1,"tool":{"configuration_digest":"bbbbbbbbbbbbbbbbbbbbbbbbbbbbbbbbbbbbbbbbbbbbbbbbbbbbbbbbbbbbbbbb","identity":"vitest","version":"4.1.10"}}