{"attestation_id":"att-1","candidate_revision":"candidate-1","command":{"argv":["pnpm","test"],"working_directory":"."},"digest":"bfd642acad50e6ed82d63a92e51cac22857e7fe8c6e2cd04fb573e61868b1adc","environment":{"os":"test"},"observed_at":"2026-08-31T00:00:00Z","proof_id":"proof-1","record_digest":"1972d0d5d3ee3fb06a2a8ca2cc97f3e239d956958368d209ebbe0a52f9b61630","record_type":"proof_attestation","result":"passed","retained_output":{"digest":"b576bf327e110a373629f7f0c0ae4aa92f13025760d0a5568271bf9f53174687","media_type":"text/plain","size_bytes":3},"schema_version":1,"tool":{"configuration_digest":"bbbbbbbbbbbbbbbbbbbbbbbbbbbbbbbbbbbbbbbbbbbbbbbbbbbbbbbbbbbbbbbb","identity":"vitest","version":"4.1.10"}}
