{"attestation_id":"att-1","candidate_revision":"candidate-1","command":{"argv":["pnpm","test"],"working_directory":"."},"digest":"64c49bfe7c51f466ec0025e61d368acadc6e55fda8e84c497d8441f14b307fe2","environment":{"os":"test"},"observed_at":"2026-08-31T00:00:00Z","proof_id":"proof-1","record_digest":"ea2fd46ffd5cbfc55e0da7113bbc66c9072cc2da3a29ef8b7eabdddc121c61e1","record_type":"proof_attestation","result":"passed","retained_output":{"digest":"af1349b9f5f9a1a6a0404dea36dcc9499bcb25c9adc112b7cc9a93cae41f3262","media_type":"application/octet-stream","size_bytes":0},"schema_version":1,"tool":{"configuration_digest":"bbbbbbbbbbbbbbbbbbbbbbbbbbbbbbbbbbbbbbbbbbbbbbbbbbbbbbbbbbbbbbbb","identity":"vitest","version":"4.1.10"}}