{"attestation_id":"att-3","candidate_revision":"candidate-3","command":{"argv":["pnpm","test"],"working_directory":"."},"digest":"86931fbd71095ed278ebb6fcddea0e276291fc5eb08b3a6e46b1d086d9d34297","environment":{"os":"test"},"observed_at":"2026-08-31T00:00:00Z","proof_id":"proof-1","record_digest":"ea2fd46ffd5cbfc55e0da7113bbc66c9072cc2da3a29ef8b7eabdddc121c61e1","record_type":"proof_attestation","result":"passed","retained_output":{"digest":"015094013f57a5277b59d8475c0501042c0b642e531b0a1c8f58d2163229e969","media_type":"application/octet-stream","size_bytes":4096},"schema_version":1,"tool":{"configuration_digest":"bbbbbbbbbbbbbbbbbbbbbbbbbbbbbbbbbbbbbbbbbbbbbbbbbbbbbbbbbbbbbbbb","identity":"vitest","version":"4.1.10"}}