{"attestation_id":"att-4","candidate_revision":"candidate-4","command":{"argv":["pnpm","test"],"working_directory":"."},"digest":"749b346939707cd03a96c7ed172c6bd4eddb71118301a8cc6fbcb248ea1dc5ba","environment":{"os":"test"},"observed_at":"2026-08-31T00:00:00Z","proof_id":"proof-1","record_digest":"ea2fd46ffd5cbfc55e0da7113bbc66c9072cc2da3a29ef8b7eabdddc121c61e1","record_type":"proof_attestation","result":"passed","retained_output":{"digest":"fee90f5cc8bda93838b6de0c43f53550a3e470b76fb2dffa02dfcdc5d223d459","media_type":"application/octet-stream","size_bytes":18},"schema_version":1,"tool":{"configuration_digest":"bbbbbbbbbbbbbbbbbbbbbbbbbbbbbbbbbbbbbbbbbbbbbbbbbbbbbbbbbbbbbbbb","identity":"vitest","version":"4.1.10"}}